Website Title,Target URL,Description/Snippet
"Submit a Tool - Submit Your AI Tool to 270+ Top Directories","https://submitatool.com/","The easiest way to submit your tool to top AI and SaaS directories. Track your submission progress with our free interactive checklist and maximize your visibility."
"Submit a Tool - Monkey AI Tools","https://www.monkeyaitools.com/submit-tool","""Submit a Tool At Monkey AI Tools, we're constantly scouting for the newest and most innovative AI tools to feature in our directory. While we comb through the web and social media to discover and catalog top-notch AI solutions, you have the opportunity to expedite your tool's submission and reach potential customers more swiftly."""
"Submit Tool to the AI Tools Directory","https://aitoolsdirectory.com/submit-tool","""Got a cool AI tool that's not listed on our site? Or do you love an AI-related product that you would like to share with others? Here's how you can submit your creation. Fill out the form below with all the necessary details, and I'll review your submission according to the guidelines (read below)."""
"Submit a Tool - AI Mojo","https://aimojo.io/submit/","""Stand out with a Verified Listing that gets your AI tool featured site-wide! From the Home page to Category and AI Tool pages, your product takes center stage across our platform."""
"Submit your Tool - IATools","https://www.iatools.tools/submit-your-tool/","""Do you have an AI tool that can help others transform their projects? At iatools.tools, we want to include the best artificial intelligence solutions in our list. By submitted your tool, you will be able to reach an audience interested in innovative AI solutions for marketing, productivity, design, data analysis, and more."""
"Submit AI Tools - AI Tool Submission Directory","https://submitaitools.org/","""Submit AI Tools - AI Tool Submission Directory Find and Explore the Best AI Tools Submit AI Tools is a comprehensive platform for discovering and evaluating AI tools, chatbots, and intelligent content generation apps — a complete reference in the world of Artificial Intelligence."""
"We Submit Your SaaS to 140+ Directories Effortlessly","https://submitsaas.com/","""Increase your SaaS visibility by submitting to 140+ directories. Save time, gain high-quality backlinks, and grow your reach with minimal effort."""
"Submit your Saas to 300+ Startup Directories - SaasPedia","https://saaspedia.io/submit-your-saas/","""Submit your saas to 300+ Startup Directories including AI, Saas and Software listing websites with our Startup & AI Saas Submission service."""
"Submit Your Saas","https://submityoursaas.com/",""""""" Submit Your Saas makes me 100x more productive. I launched my SaaS in days instead of a month. """" """" The best tool for getting early backlinks and traffic. Totally worth the price. """" """" I used to hate submitting to directories manually. Thanks for Submit Your Saas you completed the work more quickly than i expected """" """" Insane value."""
"150 Directories And Platforms To List Your SaaS - LaunchPedia","https://launchpedia.co/list-my-saas/","""Submit your saas on these directories, launch platforms, maker communities, startups sites, and get the first 1000 users for your saas."""
"160+ SaaS Directory Sites [List] to Submit Your SaaS Product","https://amrytt.com/saas-directory-sites/","""Want to list your SaaS product in 2025? Find the best SaaS directories to boost visibility, gain trust, and connect with high-intent buyers."""
"Good AI Tools - SubmitSaas - Submit Your SaaS to 100+ Directories","https://aitoolly.com/product/good-ai-tools","""SubmitSaas is an online platform designed to help you submit your SaaS (Software as a Service) product to over 100+ directories. The service simplifies the process of getting your software listed on multiple high-traffic platforms, boosting visibility, and driving qualified traffic to your website. It ensures that your SaaS is exposed to a large audience actively searching for tools that can ..."""
"Software Directory Submission Service - SaasBoost.io","https://www.gtmworks.ai/services/software-submission-service","""Software Submission Service - Upload your data once, get your SaaS submitted in up to 20+ software product directory and review sites"""
"Free Startup Submission Directories: 1000+ Sites for 2026 | Digital Biz ...","https://digitalbiztalk.com/article/the-ultimate-2026-guide-to-startup-submission-directories","""Launching a startup in 2026? This comprehensive guide explores a massive, free directory of 1000+ submission sites, offering strategies to maximize your visibility, avoid common pitfalls, and build sustainable traction for your web app or SaaS."""
"50+ Startup Directories & Launch Platforms (2026)","https://startupproject.org/resources/places-to-launch/","""Curated list of 50 startup directories and launch platforms ranked by domain authority. Get visibility, backlinks, and early users."""
"The 19 best places to list your startup (UPDATED 2026) - Flocksy","https://flocksy.com/resources/how-to-list-your-startup-and-the-top-20-startup-directories-for-site-visibility/","""What are startup directories? Startup Directories are websites that help collate and organize lists of startups and the products they have to offer. Think of it like yellow pages, but for startups and their apps."""
"Top 20 Startup Directories to Promote Your Business in 2024","https://www.feedbear.com/blog/startup-directories","Discover 20 essential startup directories to submit your business. Learn tools and strategies to boost visibility and attract your target audience."
"Best Directories and Listings to Submit Your Startup in 2025","https://www.upsilonit.com/blog/best-startup-directories-to-submit-your-startup","Discover the top startup directories and listings to submit your business. Increase your chances of success with our curated list of the best websites for startups."
"Top 11 Startup Submission Sites (2026) · Blog · Avinash Vagh","https://avinashvagh.com/blog/startup-submission-sites","""Explore 11 top startup submission sites in 2026 to promote your product, get backlinks, improve SEO, and reach early users."""
"20 Startup Directories to Submit Your Startup Today","https://noonlaunch.com/blog/20-startup-directories-to-submit-your-startup-today","""Startup directories help you earn backlinks, boost visibility, and reach early adopters. Here are 20 places to submit your startup today."""
"The Ultimate List of the Top AI Tool Directories — Best AI Tools","https://directories.bestaitools.com/","""A comprehensive, up-to-date list of AI tool directories with monthly visits, unique visitors, domain authority, and submission info."""
"Largest & Best AI Tools Directory | Free AI Tools List | AIChief","https://aichief.com/","""Discover 11,531+ AI tools across 272+ categories. Find the best AI solutions for productivity, creativity, and business. Free & premium AI tools directory."""
"Open Source Tools Directory | Curated Developer Tools","https://www.theinfinity.dev/tools","""Discover the best open source alternatives and tools. Browse through our curated collection with GitHub stars, categories, and detailed information."""
"AI Tools Directory 2025: Find Top AI Software & Apps","https://www.ebdirectory.com/","""Discover the most comprehensive AI tools directory of 2025. Browse 1500 curated AI software, machine learning platforms & productivity apps .Find the perfect AI solution for developers, businesses, and creators. Updated daily!"""
"AI Tools Directory | Discover the Top Generative AI Tools of 2025","https://caioz.com/ai-tools-directory-2025/","""AI Tools Directory 2025 is your go-to hub to explore the most powerful and trending generative AI tools curated by CAIOz.. From GPT-4o and Claude 3.7 to Midjourney and Firefly, this live AI Tools Directory helps you explore features, use cases, demo videos, and affiliate access in one interactive page. Designed for Chief AI Officers, researchers, developers, and startup founders."""
"ENUM: 93+ Best Directories to Submit Your Tool - enumhq.com","https://www.enumhq.com/directory-list","""This list only includes directories with an Authority Rank of more than 20 (with a few exceptions for lower-ranked ones, simply because we liked the service). It's important not only to publish your tool on a directory that offers visibility and backlinks, but also to consider the directory's rank. It doesn't make sense to pay for a listing on a low-ranked directory, so this list can help you ..."""
"Write a review - Trustpilot Help Center","https://help.trustpilot.com/s/article/Write-a-review?language=en_US","""To write a review on Trustpilot, you need to have had a genuine buying or service experience with the business and create a user profile. You can either write a review on your own by searching for the business or by using an invitation from the business. Reviews can be about a business, a specific location, or a product, and you can submit multiple reviews if you&apos;ve had separate ..."""
"Top 100 Review Submission Sites for SEO (2025-2026)","https://searchenginetactics.com/top-100-review-submission-sites-for-seo-2025-2026/","Discover the best review submission sites for backlinks to enhance your SEO strategy and improve your website's visibility."
"Free Review Posting Sites List - Digital Web Services","https://www.digital-web-services.com/review-posting-sites-list.html","""Free Review posting sites list, Get the best review submission websites for products and services that can improve SEO & online reputation."""
"110+ High DA Review Submission Sites List - The SEO Pedia","https://theseopedia.com/review-submission-sites-list","""Boost your SEO and online reputation with our list of high-DA review submission sites. Increase visibility, and drive more traffic today!"""
"30+ Review Sites to Collect More Customer Reviews in 2026","https://embedsocial.com/blog/review-sites/","Practical tips and a list of industry-specific websites where you can submit your business to collect and display reviews from customers."
"100+ High DA Review Submission Site List [2026 Updated]","https://linkscope.io/blog/review-submission-site-list/","""Discover 100+ FREE high DA review submission sites list for 2026. Submit reviews, earn quality backlinks, and boost SEO fast."""
"100+ High DA Review Submission Sites List (2026) - GoForPost","https://www.goforpost.com/list/high-da-review-submission-sites-list/","Write the best reviews about your products and services through high-da review submission sites list 2026. Best review posting sites."
"Best Website Review Sites in 2025 | Online Review Platforms","https://listandfuse.com/website-review-sites/","""Discover the best website review sites and online review platforms. Learn how reviews boost SEO, credibility, and traffic for your business."""
"80+ SaaS Tools Dominating The Market In 2026 - CloudZero","https://www.cloudzero.com/blog/saas-tools/","""Discover top SaaS tools to increase team productivity and operational efficiency, reduce development costs, and enhance customer service."""
"20+ Best SaaS Tools for Businesses in 2026","https://makesaasbetter.com/saas-tools/","""Explore the top SaaS tools of 2026 that are transforming businesses. Uncover key features, benefits, and how they're shaping the future."""
"30 Best SaaS Tools for Teams - Ranked & Reviewed 2026","https://www.madx.digital/learn/saas-tools","""Compare 30 essential SaaS tools ranked by features, pricing, and ROI. Our expert guide covers the top platforms to boost productivity, cut costs, and drive grow"""
"36 Must-Have SaaS Tools For Businesses [2026 List] - ProofHub","https://www.proofhub.com/articles/saas-tools-for-businesses","SaaS tools to use to take your business to the next level. Check out these 36 SaaS tools that every business should invest in."
"50 Most Popular SaaS Applications to Use in 2025","https://www.deduxer.studio/blog/50-most-popular-saas-applications-to-use-in-2024","""Key Takeaways Best SaaS applications in 2024, highlighting their role in revolutionizing business operations without the hassle of installations or hardware. Leading SaaS tools like Asana, ClickUp, and Trello are praised for their project management capabilities, while HubSpot, Mailchimp, and Hootsuite get kudos for boosting marketing productivity. Top picks for various functions include heavy ..."""
"Top 30 SaaS Tools for Business in 2026 - chatbase.co","https://www.chatbase.co/blog/saas-tools","""Looking for useful SaaS tools? This list of 30 top picks will help your business work faster, stay organized, and grow."""
"30+ trending SaaS tools for businesses of all sizes (2026)","https://replug.io/blog/best-saas-tools","""Explore the top 30+ SaaS tools for businesses in 2026 that can enhance efficiency, productivity, and growth for your brand."""
"SaaS Tools List: 160+ SaaS Tools for Online Business - SERP Forge","https://serpforge.io/saas-tools-list/","""Feeling overwhelmed by the abundance of SaaS tools? Our handy list have listed all the tools & cuts through the confusing jargon to explain what these powerful resources do and how they can streamline your online business. Whether you're looking for help with marketing, sales, customer service, or anything in between, there's a SaaS tool out there to make your life easier. Let's unlock their ..."""
"20 Free Resources to Submit Your Startup or SaaS Company","https://createandgrow.com/free-resources/","Boost visibility and SEO! Discover 20 free resources and platforms to submit your SaaS or startup for maximum exposure."
"10 Best Free Startup Directories to Launch (2026)","https://launchdirectories.com/top-10-free-launch-directories","Top 10 free directories to launch your startup. High-traffic platforms with quality backlinks. Complete submission guides."
"Startup Directory | Submit Your Startup or Product - Earlylaunch","https://www.earlylaunch.online/","""Submit your startup and explore innovative products in our curated directory. Gain visibility, attract early adopters, and grow faster with Earlylaunch."""
"Top 99 Places to Promote Your Startup for Free - LaunchList","https://getlaunchlist.com/blog/top-99-places-to-promote-your-startup-for-free","""99 free places to promote your startup in 2026 — directories, communities, and launch platforms that drive real signups, organized by what actually converts."""
"377 Places to Submit Your Startup - eyre.ai","https://eyre.ai/where-submit-website/","Looking for places to submit website of your startup? We bring you a list of 370+ directories to submit website for your next big thing."
"90+ Best Search Engine Submission Sites Updated List for Fast Indexing","https://yelomarketing.com/search-engine-submission-sites/","We tested multiple search engine submission sites and selected reliable platforms to speed up indexing and boost organic reach."
"100+ Search Engine Submission Sites for Fast Index [Updated]","https://webmetools.com/blog/search-engine-submission-sites","""100+ Top & Free Search Engine Submission Sites List 2026 Massive List of Search Engine Submission Sites List for SEO and Indexing Content. Submit your Website on New and Fresh High DA, PR, Do-Follow, Free, and Instant Approval Search Engine Submission Sites. Index your Website Free and Fast with these Search Engine Submissions in 2026."""
"Top AI Tool Directories in 2025 - Submit & Discover Cutting-Edge AI ...","https://devtechinsights.com/tool-directories-2025/","""This guide helps you navigate the top AI tool directories where you can submit your tool for discovery or browse innovative solutions. These directories drive high-quality, niche traffic, boost SEO, and in many cases, provide free listings that could lead to your first 1,000 users."""
"Best Link Submission Platforms to Boost Your SEO Backlinks in 2025","https://linkbuilder.com/blog/best-link-submission-platforms","""Discover the 7 best link submission platforms to improve your SEO. Compare pricing, domain authority, and effectiveness for white-hat backlink building in 2025."""
"Top 5 Free Websites to Submit AI Tools - toollist.ai","https://toollist.ai/article/top-5-free-websites-to-submit-ai-tools","""In the rapidly evolving world of artificial intelligence, gaining visibility for your AI tools can be challenging. Fortunately, there are several free platforms where you can submit your AI tools to reach a broader audience. Here's a comprehensive guide to the top 5 free websites for submitting AI tools."""
"50+ Free Search Engine Submission Sites","https://www.mindmingles.com/search-engine-submission-sites/","Find 50+ search engine submission sites and free web submission sites. Make your site more discoverable and improve its search engine ranking"
"Home - Submit.com","https://submit.com/","""Organizations worldwide, from governments and universities to foundations and non-profits, trust Submit.com's application management software to manage every stage of their entire lifecycle.From application intake and review to approvals, payments, and post-award reporting, our platform provides secure workflows, clear visibility, and reliable funding management tools, all in one central system."""
"Submission and SEO software from Submit Suite","http://submitsuite.com/","""SEO and submission software including Website Submitter, Feed Submitter, Article Submitter, Article Spinner and Website popularity. Submission to 4500 directories, 200 blog directories and 50 article directories. Check your page strength using Website Popularity."""
"Submit Corner - Tools - Automated Submission Engine","https://www.submitcorner.com/Tools/Submit/","Automated Submit is a free web tool which will submit your website to the top search engines automatically from one consolidated form and deliver your results in seconds."
"Submit Your AI Tool | AI Tools","https://aitools.inc/submit","Submit your tool and get listed on the fastest growing directory of AI Tools."
"SubmitPal - Auto-fill AI tool directory forms","https://submitpal.net/","""Save time submitting your AI tool to directories with SubmitPal. Auto-fill forms, track submissions, and manage multiple products - all with one click."""
"Free Website/URL submission tools help search engines discover and ...","https://www.submitshop.com/free-submit/","""Need help getting your website noticed by search engines? Free website submission tools can help you submit your URL, RSS feed, and sitemap to multiple search engines, directories and aggregators, saving you time and effort, helping you reach a wider audience, and improving your search ranking."""
"Home - Submit Your AI Tool","https://submityouraitool.com/","""Submit your AI tool for free and reach a global audience! Fast, easy listings to boost visibility and attract users. Get started today!"""
"Search for.... - TheSaaSDirectory","https://thesaasdirectory.com/","""Submit your SaaS company to The SaaS Directory, a global directory of SaaS companies."""
"Top SaaS Directories","https://www.topsaasdirectories.com/","Top SaaS Directories 100 Top Web Directory Submission Sites and Platforms to List Your SaaS All Categories Launch Platform AI Directory"
"Free List of 170+ SaaS Directories to Submit your Startup - LeadWave","https://getleadwave.io/list-of-saas-directories","""LeadWave's hand-researched list of 170+ SaaS directories and websites to list your SaaS startup. Start cooperating with them, get first customers and watch your company grow."""
"Curated List Of The Top 20 SaaS Product Directories | RevenueZen","https://revenuezen.com/saas-directories/","""Check out our favorite SaaS product directories and learn how your company can get featured, and start getting more ARR from them."""
"SaaS Directory - The Yellow Pages of SaaS","https://saasdirectory.app/","""The Yellow Pages of SaaS. Browse 360+ verified SaaS products with real revenue data, rankings, and community votes. Discover the best SaaS tools for your business."""
"SaaS Directory Finder & List of SaaS Directories — Redline Digital","https://redline.digital/saas-directories/","""TechnologyAdvice is a user-focused SaaS directory that facilitates informed purchasing decisions by providing a wide range of resources, including product listings, a resource library, and software search capabilities across various categories."""
"40+ Best Directories to Submit Your SaaS Product in 2026","https://saasconsult.co/blog/top-directories-to-list-your-saas/","""Complete list of 40+ SaaS directories to submit your product in 2026 — organised by priority, domain authority and category. Includes AI directories, review platforms and submission tips."""
"The 42 Best Tools of 2026 | Tested & Ranked - GearLab","https://www.techgearlab.com/topics/tools/best-tools","""Quality tools can last a lifetime and help you handle everything from day-to-day fix-it tasks to major home improvement projects. The GearLab testing team has purchased and tested hundreds of tools—everything from drills, and complete tool sets to top-tier cordless leaf blowers, and much more — subjecting each to rigorous side-by-side testing to figure out which ones are worthy of a place ..."""
"Submit AI Tool - AI Tools Directory","https://aitoolsdir.com/submit-ai-tool/","""Want to Update or Remove Your Tool? If your tool is already listed and you need to update details or request removal, email us at: admin@aitoolsdir.com Ready to Submit? Promote your AI tool to a growing community of engaged users, for free. Email your submission now: [admin@aitoolsdir.com] Let your AI tool be seen."""
"Submit an AI Tool | AI Tools Directory","https://aitoolsdirectory.site/submit.html","""Submit an AI Tool for Review AI Tools Directory accepts submissions from developers, startups, and creators who want to showcase useful artificial intelligence tools. All submissions are reviewed manually to ensure they provide genuine value to users before being listed in the directory."""
"Submit Tool - AI Tools List","https://aitoolslist.com/submit/","""AI Tools List is a leading directory showcasing the latest and most impactful AI-powered solutions across various categories. By submitting your tool, you'll gain exposure to developers, businesses, and AI enthusiasts looking for cutting-edge AI applications."""
"50+ Best AI Directories to Submit Your Tool (2025 Guide)","https://listmyai.net/blog/ai-directories-submit-your-tool","""I submitted my AI tool to 50+ directories. Here's which ones actually work in 2025 - the complete list with DA scores, free/paid, and submission links."""
"ListingBott - #1 for directory submission sites!","https://listingbott.com/","""#1 directory submission service on the market since 2022 Submit Website To Directories with ListingBott ListingBott - your SaaS, tool, product, newsletter, or blog listed on 100+ directories in one click, saving you days of work to focus on more creative tasks."""
"Submit Your AI Tool - Directory Tools AI","https://toolsaiapp.com/submit-your-ai-tool/","Join our community of innovators by listing your AI application or tool. Reach a wider audience and be part of the AI revolution."
"Submit AI Tool - AI Directory - diraictory.com","https://diraictory.com/submit","Submit your AI tool to our comprehensive directory. Share your artificial intelligence application with the community."
"ListYourTool.com - AI Tools Directory","https://www.listyourtool.com/submit-tool","Submit Your AI Tool to Our Directory Join the leading AI tools library and showcase your innovation to thousands of potential users. Fill out the form below to get your AI tool listed and start driving targeted traffic to your website."